{
  "$schema": "schema/foundations.schema.json",
  "tokens": {
    "resolvedFile": "tokens/primer.resolved.json",
    "tiers": [
      {
        "tier": "base",
        "text": "Raw scales: --base-size-<n> (px steps 2 to 128 and their negatives), --base-duration-<ms>, --base-easing-<name>, --base-zIndex-<n>, --base-text-weight-<name>. Base colour scales (base.color.<hue>.<step>) exist only in the token sources, never as properties; a functional colour's alias names its base step.",
        "source": "DESIGN_TOKENS_GUIDE.md"
      },
      {
        "tier": "functional",
        "text": "Purpose-named tokens components read: fgColor, bgColor, borderColor, shadow, control, controlStack, stack, space, borderRadius, borderWidth, text, motion, focus, overlay, zIndex, breakpoint.",
        "source": "DESIGN_TOKENS_GUIDE.md"
      },
      {
        "tier": "component",
        "text": "Some components have their own tier: --button-*, --buttonCounter-*, --buttonKeybindingHint-*, --label-*, --counter-*, --avatar-*, --avatarStack-*, --progressBar-*, --overlay-*, --tooltip-*, --underlineNav-*, --treeViewItem-*, --controlTrack-*, --controlKnob-*, --skeletonLoader-*, --timelineBadge-*, --topicTag-*, --selectMenu-*, --sideNav-*, --header-*, --headerSearch-*, --page-*, --menu-*, --reactionButton-*. Components without one compose functional tokens in their CSS module."
      }
    ],
    "naming": "A token is named as the CSS custom property Primer's CSS reads, --<path joined by dashes>: --fgColor-default, --control-medium-paddingInline-normal, --button-primary-bgColor-hover. The last segment of a colour token is the state where it varies by state (rest, hover, active, disabled, selected).",
    "rules": [
      {
        "text": "Never use a raw value where a token exists; read the token a component's CSS module names, even when two tokens resolve to the same value, because themes bind them apart.",
        "source": "DESIGN_TOKENS_GUIDE.md"
      },
      {
        "text": "--borderRadius-default and --borderRadius-medium are the same token under two names, as are --borderWidth-default and --borderWidth-thin, --focus-outline-offset and --outline-focus-offset, --focus-outline-width and --outline-focus-width; read whichever the module names."
      },
      {
        "text": "The display-*, data-*, prettylights-*, ansi-*, codeMirror-*, diffBlob-*, contribution-* and color-* families serve GitHub's product surfaces (issue label colours, charts, syntax and diff highlighting, deprecated aliases), not Primer React's components; a component spec names one only where its module reads it."
      }
    ],
    "units": "px for dimensions (Primer writes rem; 1rem is 16px), em where Primer sizes relative to the font, ms for durations, cubicBezier as [x1, y1, x2, y2], colours as #rrggbb or #rrggbbaa, shadows as layers of {x, y, blur, spread, color, inset}.",
    "stateVocabulary": "rest, hover, active (pressed), disabled, selected, plus checked for checkbox-like controls and focus-visible for keyboard focus. A state is its own token, not a layer blended over rest."
  },
  "themes": {
    "list": [
      "light",
      "dark",
      "dark-dimmed",
      "light-high-contrast",
      "dark-high-contrast",
      "dark-dimmed-high-contrast",
      "light-colorblind",
      "dark-colorblind",
      "light-colorblind-high-contrast",
      "dark-colorblind-high-contrast",
      "light-tritanopia",
      "dark-tritanopia",
      "light-tritanopia-high-contrast",
      "dark-tritanopia-high-contrast"
    ],
    "modes": "In tokens/primer.resolved.json value is light and every other theme is a camel-case key (darkDimmed, lightHighContrast, darkColorblindHighContrast...), present only where that theme's value differs.",
    "rules": [
      {
        "text": "Every theme binds the same names; a component never branches on the theme, only reads tokens."
      },
      {
        "text": "Colorblind themes draw success and open in blue (--fgColor-success is #0969da in light-colorblind) and danger in orange (#bc4c00); tritanopia themes draw success in blue and keep danger red. Components that pair a colour with an icon or text (StateLabel, Banner, InlineMessage) stay legible in all of them; never encode state in hue alone.",
        "tokens": [
          "--fgColor-success",
          "--fgColor-danger"
        ]
      },
      {
        "text": "High-contrast themes darken borders and muted foregrounds (--control-borderColor-rest is #d1d9e0 in light, #454c54 in light-high-contrast); read the border token even where it looks invisible in the default theme.",
        "tokens": [
          "--control-borderColor-rest"
        ]
      }
    ]
  },
  "color": {
    "families": "fgColor (text and icons), bgColor (surfaces), borderColor (strokes), each by role: default, muted, emphasis, inset, inverse, disabled, transparent, and the semantic roles below in -muted (tint) and -emphasis (solid) strengths.",
    "semantic": [
      "accent",
      "success",
      "attention",
      "severe",
      "danger",
      "open",
      "closed",
      "done",
      "draft",
      "neutral",
      "sponsors",
      "upsell"
    ],
    "pairing": [
      {
        "text": "A --bgColor-<role>-emphasis surface takes --fgColor-onEmphasis text.",
        "tokens": [
          "--bgColor-accent-emphasis",
          "--fgColor-onEmphasis"
        ],
        "source": "DESIGN_TOKENS_GUIDE.md"
      },
      {
        "text": "A --bgColor-<role>-muted surface takes --fgColor-<role> text and --borderColor-<role>-muted strokes.",
        "tokens": [
          "--bgColor-accent-muted",
          "--fgColor-accent",
          "--borderColor-accent-muted"
        ],
        "source": "DESIGN_TOKENS_GUIDE.md"
      },
      {
        "text": "--bgColor-default and --bgColor-muted take --fgColor-default; never --fgColor-muted on --bgColor-muted.",
        "tokens": [
          "--bgColor-default",
          "--bgColor-muted",
          "--fgColor-default",
          "--fgColor-muted"
        ],
        "source": "DESIGN_TOKENS_GUIDE.md"
      }
    ],
    "rules": [
      {
        "text": "Text meets 4.5:1 against its surface and large text and UI strokes 3:1 (WCAG AA).",
        "source": "DESIGN_TOKENS_GUIDE.md"
      },
      {
        "text": "The page is --bgColor-default with --fgColor-default text; links are --fgColor-accent (BaseStyles), underlined on hover.",
        "tokens": [
          "--bgColor-default",
          "--fgColor-default",
          "--fgColor-accent"
        ],
        "source": "BaseStyles.module.css:56-79"
      },
      {
        "text": "Selected text is highlighted in --selection-bgColor.",
        "tokens": [
          "--selection-bgColor"
        ]
      }
    ]
  },
  "typography": {
    "ramp": [
      {
        "role": "display",
        "tokens": [
          "--text-display-shorthand"
        ]
      },
      {
        "role": "title-large",
        "tokens": [
          "--text-title-shorthand-large"
        ]
      },
      {
        "role": "title-medium",
        "tokens": [
          "--text-title-shorthand-medium"
        ]
      },
      {
        "role": "title-small",
        "tokens": [
          "--text-title-shorthand-small"
        ]
      },
      {
        "role": "subtitle",
        "tokens": [
          "--text-subtitle-shorthand"
        ]
      },
      {
        "role": "body-large",
        "tokens": [
          "--text-body-shorthand-large"
        ]
      },
      {
        "role": "body-medium",
        "tokens": [
          "--text-body-shorthand-medium"
        ]
      },
      {
        "role": "body-small",
        "tokens": [
          "--text-body-shorthand-small"
        ]
      },
      {
        "role": "caption",
        "tokens": [
          "--text-caption-shorthand"
        ]
      },
      {
        "role": "code-block",
        "tokens": [
          "--text-codeBlock-shorthand"
        ]
      },
      {
        "role": "code-inline",
        "tokens": [
          "--text-codeInline-shorthand"
        ]
      }
    ],
    "weights": {
      "text": "light 300, normal 400, medium 500, semibold 600; controls (Button, SegmentedControl) set their label in medium; titles are semibold.",
      "tokens": [
        "--base-text-weight-light",
        "--base-text-weight-normal",
        "--base-text-weight-medium",
        "--base-text-weight-semibold"
      ]
    },
    "fontStacks": {
      "text": "--fontStack-system (Mona Sans VF, then the platform UI face: -apple-system, Segoe UI, Noto Sans, Helvetica, Arial) for all UI text and --fontStack-monospace for code. A native build draws in the platform's UI sans and its monospace; Mona Sans is optional (OFL-1.1, github/mona-sans).",
      "tokens": [
        "--fontStack-system",
        "--fontStack-monospace"
      ]
    },
    "rules": [
      {
        "text": "Set text with a shorthand token so size, line height and weight move together; use the separate size and line-height tokens only where a module does (Button's label).",
        "source": "DESIGN_TOKENS_GUIDE.md"
      },
      {
        "text": "Body default is body-medium (14px over 21px), which is also BaseStyles' 1.5 line height.",
        "tokens": [
          "--text-body-shorthand-medium"
        ],
        "source": "BaseStyles.module.css:56-62"
      },
      {
        "text": "Never set multi-line body text in caption.",
        "source": "DESIGN_TOKENS_GUIDE.md"
      }
    ]
  },
  "shape": {
    "radii": {
      "text": "small 3px (labels, tokens' inner parts), medium 6px (controls, cards, overlays: the default), large 12px (dialogs, large surfaces), full 9999px (pills: CounterLabel, Label, ToggleSwitch, avatars).",
      "tokens": [
        "--borderRadius-small",
        "--borderRadius-medium",
        "--borderRadius-large",
        "--borderRadius-full"
      ]
    },
    "borders": {